<?xml version="1.0" encoding="UTF-8"?>
<student xmlns:xsi="http://www.w3.org/2001/XMLSchema-instance" xsi:noNamespaceSchemaLocation="student.xsd">
  <studentID>12345</studentID>
  <identityCard>987654321</identityCard>
  <fullName>Nguyen Van A</fullName>
  <birthDate>2000-01-01</birthDate>
  <email>nguyenvana@example.com</email>
  <age>22</age>
  <gender>abc</gender>
</student>
